{
  "id": "prun_2026_08_21_f5d8aff10e13",
  "pipelineTaskId": "ptask_2026_08_21_66f2dd40a461",
  "rawArtifactId": "raw_2026_08_21_orbbec_com_cn_4ae6dae4a7",
  "routeDecisionId": "route_2026_08_21_ef9a3bc49b6c",
  "pipeline": "supply_chain_pipeline",
  "status": "completed",
  "startedAt": "2026-08-21T16:15:55+08:00",
  "finishedAt": "2026-08-21T16:15:55+08:00",
  "claimIds": [
    "claim_2026_08_21_other_ffdebafa93"
  ],
  "evidenceIds": [
    "evd_2026_08_21_other_ffdebafa93"
  ],
  "ruleOutputIds": [
    "rout_2026_08_21_supply_chain_material_v0_bb67b5da91"
  ],
  "error": null,
  "notes": "Pipeline execution created rule_output plus inbox claim/evidence candidates only."
}
