{
  "id": "prun_2026_07_23_cebbb5062af7",
  "pipelineTaskId": "ptask_2026_07_23_3f54af39ebbe",
  "rawArtifactId": "raw_2026_05_19_static_cninfo_com_cn_cc3b255e2e",
  "routeDecisionId": "route_2026_05_19_56c3c478e22f",
  "pipeline": "filing_pipeline",
  "status": "completed",
  "startedAt": "2026-07-23T16:16:18+08:00",
  "finishedAt": "2026-07-23T16:16:18+08:00",
  "claimIds": [
    "claim_2026_05_19_filing_0414338f01"
  ],
  "evidenceIds": [
    "evd_2026_05_19_filing_0414338f01"
  ],
  "ruleOutputIds": [
    "rout_2026_05_19_filing_material_v0_14bbd3f998"
  ],
  "error": null,
  "notes": "Pipeline execution created rule_output plus inbox claim/evidence candidates only."
}
