{
  "id": "prun_2026_07_29_4c644203a3d0",
  "pipelineTaskId": "ptask_2026_07_29_f39a99f5ec6a",
  "rawArtifactId": "raw_2026_07_29_static_cninfo_com_cn_d4ca02ebde",
  "routeDecisionId": "route_2026_07_29_ee9829d619b0",
  "pipeline": "filing_pipeline",
  "status": "completed",
  "startedAt": "2026-07-29T16:16:18+08:00",
  "finishedAt": "2026-07-29T16:16:18+08:00",
  "claimIds": [
    "claim_2026_07_29_filing_ac427cd2d6"
  ],
  "evidenceIds": [
    "evd_2026_07_29_filing_ac427cd2d6"
  ],
  "ruleOutputIds": [
    "rout_2026_07_29_filing_material_v0_b27d9344e2"
  ],
  "error": null,
  "notes": "Pipeline execution created rule_output plus inbox claim/evidence candidates only."
}
