{
  "id": "prun_2026_07_23_ad39b0112e84",
  "pipelineTaskId": "ptask_2026_07_23_53d332784f59",
  "rawArtifactId": "raw_2026_06_23_static_cninfo_com_cn_a125514d86",
  "routeDecisionId": "route_2026_06_23_5f010f3a140a",
  "pipeline": "filing_pipeline",
  "status": "completed",
  "startedAt": "2026-07-23T09:50:57+08:00",
  "finishedAt": "2026-07-23T09:50:57+08:00",
  "claimIds": [
    "claim_2026_06_23_filing_54f3c26ab6"
  ],
  "evidenceIds": [
    "evd_2026_06_23_filing_54f3c26ab6"
  ],
  "ruleOutputIds": [
    "rout_2026_06_23_filing_material_v0_fee6ed724d"
  ],
  "error": null,
  "notes": "Pipeline execution created rule_output plus inbox claim/evidence candidates only."
}
