{
  "id": "prun_2026_07_23_c4726ad20696",
  "pipelineTaskId": "ptask_2026_07_23_bb1af8148ffb",
  "rawArtifactId": "raw_2026_03_31_static_cninfo_com_cn_96d46b13df",
  "routeDecisionId": "route_2026_03_31_75983297f842",
  "pipeline": "filing_pipeline",
  "status": "completed",
  "startedAt": "2026-07-23T09:56:05+08:00",
  "finishedAt": "2026-07-23T09:56:05+08:00",
  "claimIds": [
    "claim_2026_03_31_filing_020b70496d"
  ],
  "evidenceIds": [
    "evd_2026_03_31_filing_020b70496d"
  ],
  "ruleOutputIds": [
    "rout_2026_03_31_filing_material_v0_675b4246e1"
  ],
  "error": null,
  "notes": "Pipeline execution created rule_output plus inbox claim/evidence candidates only."
}
