{
  "id": "prun_2026_07_23_3ebc1e44f8a7",
  "pipelineTaskId": "ptask_2026_07_23_39f882a55534",
  "rawArtifactId": "raw_2026_05_23_static_cninfo_com_cn_65004a36db",
  "routeDecisionId": "route_2026_05_23_eadb8136f69b",
  "pipeline": "filing_pipeline",
  "status": "completed",
  "startedAt": "2026-07-23T09:51:08+08:00",
  "finishedAt": "2026-07-23T09:51:08+08:00",
  "claimIds": [
    "claim_2026_05_23_filing_87b3536bdb"
  ],
  "evidenceIds": [
    "evd_2026_05_23_filing_87b3536bdb"
  ],
  "ruleOutputIds": [
    "rout_2026_05_23_filing_material_v0_cf2a3c2a14"
  ],
  "error": null,
  "notes": "Pipeline execution created rule_output plus inbox claim/evidence candidates only."
}
