{
  "id": "prun_2026_07_23_e6b22484cc5b",
  "pipelineTaskId": "ptask_2026_07_23_a8099a60ec9a",
  "rawArtifactId": "raw_2026_06_13_static_cninfo_com_cn_2d1eee78b1",
  "routeDecisionId": "route_2026_06_13_54fe930a9544",
  "pipeline": "filing_pipeline",
  "status": "completed",
  "startedAt": "2026-07-23T09:50:59+08:00",
  "finishedAt": "2026-07-23T09:50:59+08:00",
  "claimIds": [
    "claim_2026_06_13_filing_450ae82b8b"
  ],
  "evidenceIds": [
    "evd_2026_06_13_filing_450ae82b8b"
  ],
  "ruleOutputIds": [
    "rout_2026_06_13_filing_material_v0_54d77d9725"
  ],
  "error": null,
  "notes": "Pipeline execution created rule_output plus inbox claim/evidence candidates only."
}
