{
  "id": "prun_2026_07_23_148cd74f9660",
  "pipelineTaskId": "ptask_2026_07_23_77522043cc6f",
  "rawArtifactId": "raw_2026_04_28_static_cninfo_com_cn_82030dfcfa",
  "routeDecisionId": "route_2026_04_28_4dcfe6bfe284",
  "pipeline": "filing_pipeline",
  "status": "completed",
  "startedAt": "2026-07-23T09:51:17+08:00",
  "finishedAt": "2026-07-23T09:51:17+08:00",
  "claimIds": [
    "claim_2026_04_28_filing_994a424bc9"
  ],
  "evidenceIds": [
    "evd_2026_04_28_filing_994a424bc9"
  ],
  "ruleOutputIds": [
    "rout_2026_04_28_filing_material_v0_29034fc1e4"
  ],
  "error": null,
  "notes": "Pipeline execution created rule_output plus inbox claim/evidence candidates only."
}
