{
  "id": "prun_2026_07_22_90b7917462aa",
  "pipelineTaskId": "ptask_2026_07_22_026d5063d29f",
  "rawArtifactId": "raw_2026_07_22_static_cninfo_com_cn_726beac856",
  "routeDecisionId": "route_2026_07_22_f6b7c3e7040c",
  "pipeline": "filing_pipeline",
  "status": "completed",
  "startedAt": "2026-07-22T21:15:03+08:00",
  "finishedAt": "2026-07-22T21:15:03+08:00",
  "claimIds": [
    "claim_2026_07_22_filing_0c0387aa5f"
  ],
  "evidenceIds": [
    "evd_2026_07_22_filing_0c0387aa5f"
  ],
  "ruleOutputIds": [
    "rout_2026_07_22_filing_material_v0_93f587d3f1"
  ],
  "error": null,
  "notes": "Pipeline execution created rule_output plus inbox claim/evidence candidates only."
}
