{
  "id": "prun_2026_07_20_250a20752ba9",
  "pipelineTaskId": "ptask_2026_07_20_f4dea93228cd",
  "rawArtifactId": "raw_2026_07_20_agibot_com_cn_7289d33025",
  "routeDecisionId": "route_2026_07_20_e75dbe8238d6",
  "pipeline": "company_pipeline",
  "status": "completed",
  "startedAt": "2026-07-20T16:15:56+08:00",
  "finishedAt": "2026-07-20T16:15:56+08:00",
  "claimIds": [
    "claim_2026_07_20_other_98ddb6ac97"
  ],
  "evidenceIds": [
    "evd_2026_07_20_other_98ddb6ac97"
  ],
  "ruleOutputIds": [
    "rout_2026_07_20_company_material_v0_24e02db8e5"
  ],
  "error": null,
  "notes": "Pipeline execution created rule_output plus inbox claim/evidence candidates only."
}
