{
  "id": "prun_2026_07_23_8ce1253a4d5f",
  "pipelineTaskId": "ptask_2026_07_23_4e8c16e0cce1",
  "rawArtifactId": "raw_2025_04_29_static_cninfo_com_cn_befbf12739",
  "routeDecisionId": "route_2025_04_29_1d004c1c53d6",
  "pipeline": "filing_pipeline",
  "status": "completed",
  "startedAt": "2026-07-23T09:56:13+08:00",
  "finishedAt": "2026-07-23T09:56:13+08:00",
  "claimIds": [
    "claim_2025_04_29_filing_4e7c8180c2"
  ],
  "evidenceIds": [
    "evd_2025_04_29_filing_4e7c8180c2"
  ],
  "ruleOutputIds": [
    "rout_2025_04_29_filing_material_v0_3ac703fd31"
  ],
  "error": null,
  "notes": "Pipeline execution created rule_output plus inbox claim/evidence candidates only."
}
