{
  "id": "prun_2026_07_15_abee8695ff64",
  "pipelineTaskId": "ptask_2026_07_15_4ce67c4eed82",
  "rawArtifactId": "raw_2026_07_02_static_cninfo_com_cn_9ab49e37a0",
  "routeDecisionId": "route_2026_07_02_e755bab6791c",
  "pipeline": "filing_pipeline",
  "status": "completed",
  "startedAt": "2026-07-15T11:03:07+08:00",
  "finishedAt": "2026-07-15T11:03:07+08:00",
  "claimIds": [
    "claim_2026_07_02_filing_81d5cbfe44"
  ],
  "evidenceIds": [
    "evd_2026_07_02_filing_81d5cbfe44"
  ],
  "ruleOutputIds": [
    "rout_2026_07_02_filing_material_v0_127ce6ec1a"
  ],
  "error": null,
  "notes": "Pipeline execution created rule_output plus inbox claim/evidence candidates only."
}
