{
  "id": "prun_2026_07_23_1267c0005606",
  "pipelineTaskId": "ptask_2026_07_23_dcc053daff88",
  "rawArtifactId": "raw_2026_06_09_static_cninfo_com_cn_00d2d21382",
  "routeDecisionId": "route_2026_06_09_64b14f4755cc",
  "pipeline": "filing_pipeline",
  "status": "completed",
  "startedAt": "2026-07-23T09:51:00+08:00",
  "finishedAt": "2026-07-23T09:51:00+08:00",
  "claimIds": [
    "claim_2026_06_09_filing_08f57cc989"
  ],
  "evidenceIds": [
    "evd_2026_06_09_filing_08f57cc989"
  ],
  "ruleOutputIds": [
    "rout_2026_06_09_filing_material_v0_9d33394cb0"
  ],
  "error": null,
  "notes": "Pipeline execution created rule_output plus inbox claim/evidence candidates only."
}
