{
  "id": "prun_2026_08_07_b56c23755644",
  "pipelineTaskId": "ptask_2026_08_07_39fc9b2927ae",
  "rawArtifactId": "raw_2026_08_07_static_cninfo_com_cn_cddb6a7b73",
  "routeDecisionId": "route_2026_08_07_6bdc7fd9a800",
  "pipeline": "filing_pipeline",
  "status": "completed",
  "startedAt": "2026-08-07T16:16:18+08:00",
  "finishedAt": "2026-08-07T16:16:18+08:00",
  "claimIds": [
    "claim_2026_08_07_filing_877cab72a5"
  ],
  "evidenceIds": [
    "evd_2026_08_07_filing_877cab72a5"
  ],
  "ruleOutputIds": [
    "rout_2026_08_07_filing_material_v0_d2ba35a18b"
  ],
  "error": null,
  "notes": "Pipeline execution created rule_output plus inbox claim/evidence candidates only."
}
