{
  "id": "prun_2026_07_23_174ec4f41f6d",
  "pipelineTaskId": "ptask_2026_07_23_2258e3b182fc",
  "rawArtifactId": "raw_2026_05_30_static_cninfo_com_cn_800f195fe3",
  "routeDecisionId": "route_2026_05_30_37351c00cb13",
  "pipeline": "filing_pipeline",
  "status": "completed",
  "startedAt": "2026-07-23T09:51:05+08:00",
  "finishedAt": "2026-07-23T09:51:05+08:00",
  "claimIds": [
    "claim_2026_05_30_filing_2d3c8c1199"
  ],
  "evidenceIds": [
    "evd_2026_05_30_filing_2d3c8c1199"
  ],
  "ruleOutputIds": [
    "rout_2026_05_30_filing_material_v0_7a3e247568"
  ],
  "error": null,
  "notes": "Pipeline execution created rule_output plus inbox claim/evidence candidates only."
}
