{
  "id": "prun_2026_07_23_fbbe8c8cd8f3",
  "pipelineTaskId": "ptask_2026_07_23_08c3a3b77c7d",
  "rawArtifactId": "raw_2026_06_16_static_cninfo_com_cn_bd6d47dcca",
  "routeDecisionId": "route_2026_06_16_b8f1668cd5f7",
  "pipeline": "filing_pipeline",
  "status": "completed",
  "startedAt": "2026-07-23T09:50:58+08:00",
  "finishedAt": "2026-07-23T09:50:58+08:00",
  "claimIds": [
    "claim_2026_06_16_filing_89b7d7f1bd"
  ],
  "evidenceIds": [
    "evd_2026_06_16_filing_89b7d7f1bd"
  ],
  "ruleOutputIds": [
    "rout_2026_06_16_filing_material_v0_bb2b19714f"
  ],
  "error": null,
  "notes": "Pipeline execution created rule_output plus inbox claim/evidence candidates only."
}
